key,version,code,creationMoment,name,statement,startDate,finishDate,ration,furtherInfo,key:artefact
xomemi-01,0,220603#123,2022/05/02 15:22,Titulo del primer chimpum,Descripci贸n del primer chimpum,2022/07/04 15:22,2022/10/06 17:10,EUR 50.00,,item-02
xomemi-02,0,220603#124,2022/05/02 17:00,Titulo del segundo chimpum,Descripci贸n del segundo chimpum,2022/07/01 10:22,2022/10/02 08:10,EUR 130.00,,item-01
xomemi-03,0,220603#125,2022/04/010 17:08,Titulo del tercer chimpum,Descripci贸n del tercer chimpum,2022/07/03 15:05,2022/10/06 13:10,USD 20.00,,item-03
xomemi-04,0,220603#126,2022/05/10 20:20,Titulo del cuarto chimpum,Descripci贸n del cuarto chimpum,2022/07/04 15:22,2022/10/09 17:10,USD 100.00,,item-04
xomemi-05,0,220603#127,2022/05/10 20:20,Titulo de la prueba,Descripcion de la prueba,2022/07/10 20:20,2022/11/11 20:20,EUR 50.00,,item-08
